{
  "schema_version": 2,
  "release_id": "2.0.0-dev",
  "reference_platform": {
    "os": "darwin",
    "kernel": "24.6.0",
    "arch": "arm64"
  },
  "claim": "No direct target IP/DNS egress is known or observed through the complete, versioned, enumerated transport/navigation/execution matrix; every supported release is packet-capture tested, and unsupported surfaces are disabled or fail closed.",
  "browsers": [
    {
      "family": "chromium",
      "channel": "stable",
      "exact_build": "150.0.7871.124",
      "product_build_id": "1639810",
      "platform": "darwin-arm64",
      "archive_url": "https://storage.googleapis.com/chrome-for-testing-public/150.0.7871.124/mac-arm64/chrome-mac-arm64.zip",
      "archive_sha256": "36c8b5fe04c08a418a172206bb392600ec1550941bde6af2d4353df21db87a47",
      "binary_path": ".puppeteer-cache/chrome/mac_arm-150.0.7871.124/chrome-mac-arm64/Google Chrome for Testing.app/Contents/MacOS/Google Chrome for Testing",
      "binary_sha256": "22ddf33cec88bbfd181588eb3da31250a65ba8ebfdb6efcd2694a36275697284",
      "binary_present": true,
      "shared_worker": true,
      "native_oracle_passed": true,
      "runtime_gate_passed": false,
      "transport_gate_passed": false,
      "performance_gate_passed": false,
      "soak_gate_passed": false,
      "corpus_gate_passed": false,
      "release_supported": false,
      "packet_capture_certified": false
    },
    {
      "family": "firefox",
      "channel": "stable",
      "exact_build": "152.0.6",
      "product_build_id": "20260713164047",
      "platform": "darwin-arm64",
      "archive_url": "https://archive.mozilla.org/pub/firefox/releases/152.0.6/mac/en-US/Firefox%20152.0.6.dmg",
      "archive_sha256": "747002d592063e0b106de0c500b34fe6d84438b3b866621521c8e7be9ea7816c",
      "binary_path": ".puppeteer-cache/firefox/mac_arm-stable_152.0.6/Firefox.app/Contents/MacOS/firefox",
      "binary_sha256": "8489f35e3b2ee8b7ca8aaa34ae0762d3faa884ccef8cbeecfad0cae213b7c0e7",
      "binary_present": true,
      "shared_worker": true,
      "native_oracle_passed": true,
      "runtime_gate_passed": false,
      "transport_gate_passed": false,
      "performance_gate_passed": false,
      "soak_gate_passed": false,
      "corpus_gate_passed": false,
      "release_supported": false,
      "packet_capture_certified": false
    }
  ],
  "deferred_browser_families": [],
  "unsupported": [
    "mobile",
    "webview",
    "safari-without-real-device-evidence",
    "webrtc",
    "webtransport",
    "direct-udp",
    "raw-sockets",
    "background-sync",
    "push",
    "payment-handler",
    "synchronous-xhr"
  ],
  "egress_surfaces": [
    "html-svg-mathml-attributes",
    "css",
    "fetch",
    "xhr",
    "eventsource",
    "beacon",
    "forms",
    "navigation",
    "frames",
    "scripts",
    "modules",
    "workers",
    "websockets",
    "webrtc-block",
    "emerging-api-block"
  ],
  "stealth_oracle": [
    "global-equality",
    "window-location-reflection",
    "canonical-wrapper-identity",
    "function-reflection",
    "target-dom",
    "parser-ordering",
    "errors-and-source",
    "performance-observability",
    "policy-violations",
    "target-service-worker",
    "internal-url-concealment",
    "root-injection-concealment"
  ],
  "universal_undetectability_claim": false,
  "mathematical_no_egress_claim": false
}
